Name,Tags,Creator,Link,Wiki Tags
,,Jim,,
,,Jim,,
,,Jim,,
Wie funktioniert das KYC?,,Jim,,"App, Help Guides"
Wie kann ich einen Wettschein hochladen? / Wie kann ich einen Wettschein posten?,,Jim,,"App, Help Guides"
Ein Video aufnehmen,,Jim,,"App, Help Guides"
Die Wallet benutzen,,Jim,,"App, Help Guides"
Chatbot Content,,Jim,,Help Guides
App,,Jim,,"App, Help Guides"
Website (Sportsbook),,Jim,,"Help Guides, Sportbook"
Ich habe meinen Benutzernamen vergessen. Wie kann ich mich wieder anmelden?,,Jim,,"Help Guides, Sportbook"
Ich habe meinen Benutzernamen vergessen. Wie kann ich mich wieder anmelden?,,thomas schultz,,"Help Guides, Sportbook"
Ich habe mein Passwort vergessen. / Ich weiß mein Passwort nicht mehr.,,thomas schultz,,"Help Guides, Sportbook"
Wo kann ich mich im Kundenkonto wieder abmelden/ausloggen?,,thomas schultz,,"Help Guides, Sportbook"
Wie kann ich mein Konto wieder reaktivieren/öffnen?,,thomas schultz,,"Help Guides, Sportbook"
Wo kann ich mich registrieren?/Wie kann ich ein Konto eröffnen?,,thomas schultz,,"Help Guides, Sportbook"
Warum kann ich mich nicht registrieren? / Warum funktioniert die Registrierung nicht.,,thomas schultz,,"Help Guides, Sportbook"
Warum muss ich mich verifizieren? / Warum muss ich mein Kundenkonto verifizieren?,,thomas schultz,,"Help Guides, Sportbook"
Wie kann ich mein Kundenkonto verifizieren? Welche Dokumente werden für die Verifizierung benötigt?,,thomas schultz,,"Help Guides, Sportbook"
Wann erhalte ich meinen Bonus? / Wo bleibt mein Bonus?,,thomas schultz,,"Help Guides, Sportbook"
Wo kann ich im Kundenkonto mein Passwort ändern? / Wie kann ich mein Passwort ändern?,,thomas schultz,,"Help Guides, Sportbook"
Kann ich mich mehrmals registrieren?,,thomas schultz,,"Help Guides, Sportbook"
Wie kann ich meine Mailadresse im Kundenkonto ändern? / Wo kann ich meine Mailadresse im Kundenkonto ändern? Andere Mailadresse im Kundenkonto hinterlegen?,,thomas schultz,,"Help Guides, Sportbook"
Muss ich bei der Registrierung eine Einzahlung tätigen?,,thomas schultz,,"Help Guides, Sportbook"
Wie kann ich meinen Bonus stornieren? / Ich möchte den Bonus nicht.,,thomas schultz,,"Help Guides, Sportbook"
Welche Zahlungsmethoden kann ich bei einer Einzahlung benutzen?,,thomas schultz,,"Help Guides, Sportbook"
Meine Einzahlung ist noch nicht in meinem Kundenkonto sichtbar. / Warum wird meine Einzahlung nicht angezeigt?,,thomas schultz,,"Help Guides, Sportbook"
Warum funktioniert die Einzahlung nicht? / Ich kann keine Einzahlung tätigen.,,thomas schultz,,"Help Guides, Sportbook"
Wo kann ich eine Einzahlung vornehmen? /  Wie kann ich eine Einzahlung vornehmen?,,thomas schultz,,"Help Guides, Sportbook"
Wo bleibt meine Auszahlung? / Ich warte auf meine Auszahlung / Wie lange dauert meine Auszahlung?,,thomas schultz,,"Help Guides, Sportbook"
Wie kann ich ein Video erstellen?,,thomas schultz,,"App, Help Guides"
Wie lade ich ein Video hoch?,,thomas schultz,,"App, Help Guides"
Wie ändere ich meinen Namen im Profil?,,thomas schultz,,"App, Help Guides"
Wie ändere ich meinen Benutzernamen?,,thomas schultz,,"App, Help Guides"
Wie kann ich ein Profilbild erstellen? / Wie kann ich ein Profilbild hinzufügen?,,thomas schultz,,"App, Help Guides"
Wie kann ich mein Profilbild ändern?,,thomas schultz,,"App, Help Guides"
Wie ändere ich den Text in meinem Profil?,,thomas schultz,,"App, Help Guides"
Wie kann ich einen Gruppenchat erstellen?,,thomas schultz,,"App, Help Guides"
Wie kann ich einen Gruppenchat löschen?,,thomas schultz,,"App, Help Guides"
Wie kann ich einen Gruppenchat stumm schalten? / Wie kann ich einen Gruppenchat stumm stellen?,,thomas schultz,,"App, Help Guides"
Wie kann ich bei einem Gruppenchat die Stummschaltung wieder aufheben?,,thomas schultz,,"App, Help Guides"
Wie kann ich mit einem anderen User schreiben?,,thomas schultz,,"App, Help Guides"
Wie kann ich einen Wettschein hochladen? / Wie kann ich einen Wettschein posten?,,thomas schultz,,"App, Help Guides"
Unter welcher Email kann ich SuperSiuu erreichen?,,Jim,,